row_id,wine_id,country,description,designation,points,price,province,region_1,region_2,taster_name,taster_twitter_handle,title,variety,winery,text
59282,wine_59282,New Zealand,"The deep gold color with a hint of copper suggests some skin contact. The attractive melon, lychee and spice aromas quickly dissipate with air, leaving mot much more than a slight astringency on the finish. Sourced from Nelson.",,83,25.0,New Zealand,,,Joe Czerwinski,@JoeCz,Crowded House 2007 Pinot Gris (New Zealand),Pinot Gris,Crowded House,"Wine for preference modeling. Title: Crowded House 2007 Pinot Gris (New Zealand). Variety: Pinot Gris. Country: New Zealand. Province: New Zealand. Points: 83. Price: 25.0. Description: The deep gold color with a hint of copper suggests some skin contact. The attractive melon, lychee and spice aromas quickly dissipate with air, leaving mot much more than a slight astringency on the finish. Sourced from Nelson."
43649,wine_43649,Spain,"CVNE's top wines from 2010 are outstanding across the board. This sun-baked wine is bursting with black cherry, blackberry, spice, vanilla and cedary aromas. A tight, exact and fresh palate blends richness and balance, while ripe blackberry, cassis and black pepper flavors finish with a pure feel, a touch of buttery oak, and nuances of licorice and herbs. Drink this modern beauty through 2025.",Pagos de Viña Real,95,110.0,Northern Spain,Rioja,,Michael Schachner,@wineschach,CVNE 2010 Pagos de Viña Real  (Rioja),Tempranillo Blend,CVNE,"Wine for preference modeling. Title: CVNE 2010 Pagos de Viña Real (Rioja). Variety: Tempranillo Blend. Country: Spain. Province: Northern Spain. Points: 95. Price: 110.0. Description: CVNE's top wines from 2010 are outstanding across the board. This sun-baked wine is bursting with black cherry, blackberry, spice, vanilla and cedary aromas. A tight, exact and fresh palate blends richness and balance, while ripe blackberry, cassis and black pepper flavors finish with a pure feel, a touch of buttery oak, and nuances of licorice and herbs. Drink this modern beauty through 2025."
54168,wine_54168,Spain,"Oaky, concentrated black-fruit aromas feature notes of graphite and savory earth. This Monastrell is deep, jammy and textured on a full-bodied palate. Spicy oak and black-plum flavors finish toasty, with hints of baking spices and dried herbs. Drink through 2019.",La Finca Selección Monastrell,90,35.0,Levante,Jumilla,,Michael Schachner,@wineschach,Baica 2015 La Finca Selección Monastrell Monastrell (Jumilla),Monastrell,Baica,"Wine for preference modeling. Title: Baica 2015 La Finca Selección Monastrell Monastrell (Jumilla). Variety: Monastrell. Country: Spain. Province: Levante. Points: 90. Price: 35.0. Description: Oaky, concentrated black-fruit aromas feature notes of graphite and savory earth. This Monastrell is deep, jammy and textured on a full-bodied palate. Spicy oak and black-plum flavors finish toasty, with hints of baking spices and dried herbs. Drink through 2019."
64349,wine_64349,US,"Journaux, the winery notes, is an old Burgundian term for the amount of land a person could plow by horse in a single day. The Azana vineyard is the source for the fruit, and is about four journaux in size. It brings flavors of strawberry candy, raspberry soda, and a bit of Dr Pepper. At first a forward, fruity, charming wine, it turns brambly and herbal in the well-balanced finish.",Quatre Journaux,91,70.0,Oregon,Chehalem Mountains,Willamette Valley,Paul Gregutt,@paulgwine,Scott Paul 2012 Quatre Journaux Pinot Noir (Chehalem Mountains),Pinot Noir,Scott Paul,"Wine for preference modeling. Title: Scott Paul 2012 Quatre Journaux Pinot Noir (Chehalem Mountains). Variety: Pinot Noir. Country: US. Province: Oregon. Points: 91. Price: 70.0. Description: Journaux, the winery notes, is an old Burgundian term for the amount of land a person could plow by horse in a single day. The Azana vineyard is the source for the fruit, and is about four journaux in size. It brings flavors of strawberry candy, raspberry soda, and a bit of Dr Pepper. At first a forward, fruity, charming wine, it turns brambly and herbal in the well-balanced finish."
128350,wine_128350,US,"It's swanky because of the crisp acidity and dryness, and the minerality that boosts the lemon, lime and Asian pear flavors. An easy-to-like wine that feels elegant.",Swanky White,88,12.0,California,California,California Other,,,Hey Mambo 2009 Swanky White White (California),White Blend,Hey Mambo,"Wine for preference modeling. Title: Hey Mambo 2009 Swanky White White (California). Variety: White Blend. Country: US. Province: California. Points: 88. Price: 12.0. Description: It's swanky because of the crisp acidity and dryness, and the minerality that boosts the lemon, lime and Asian pear flavors. An easy-to-like wine that feels elegant."
38887,wine_38887,France,"Aromas of green apples bring a fresh burst of acidity. The wine is bright, with a firm texture of lime zest and red apple skins.",Colombard,86,12.0,Southwest France,Vin de Pays des Côtes de Gascogne,,Roger Voss,@vossroger,Domaine de Mirail 2008 Colombard Colombard (Vin de Pays des Côtes de Gascogne),Colombard,Domaine de Mirail,"Wine for preference modeling. Title: Domaine de Mirail 2008 Colombard Colombard (Vin de Pays des Côtes de Gascogne). Variety: Colombard. Country: France. Province: Southwest France. Points: 86. Price: 12.0. Description: Aromas of green apples bring a fresh burst of acidity. The wine is bright, with a firm texture of lime zest and red apple skins."
81957,wine_81957,,"This wine is made from grapes grown in the Lake Balaton region and has aromas of lemon blossom, vanilla and lemon curd, which lead the way to well-combined flavors of green apple, pear and pineapple. It is medium bodied on the palate with a clean finish.",Márga,89,18.0,,,,Jeff Jenssen,@worldwineguys,St. Donat 2015 Márga Furmint,Furmint,St. Donat,"Wine for preference modeling. Title: St. Donat 2015 Márga Furmint. Variety: Furmint. Country: . Province: . Points: 89. Price: 18.0. Description: This wine is made from grapes grown in the Lake Balaton region and has aromas of lemon blossom, vanilla and lemon curd, which lead the way to well-combined flavors of green apple, pear and pineapple. It is medium bodied on the palate with a clean finish."
70070,wine_70070,US,"Chris Gorman's “Devil” project includes this juicy, fruity red blend, based mostly upon Bordeaux grapes. The forward cherry-berry flavors push through with some power into a chocolate-malted explosion with peppery highlights.",The Devil You Know,89,28.0,Washington,Columbia Valley (WA),Columbia Valley,Paul Gregutt,@paulgwine,Gorman 2012 The Devil You Know Red (Columbia Valley (WA)),Red Blend,Gorman,"Wine for preference modeling. Title: Gorman 2012 The Devil You Know Red (Columbia Valley (WA)). Variety: Red Blend. Country: US. Province: Washington. Points: 89. Price: 28.0. Description: Chris Gorman's “Devil” project includes this juicy, fruity red blend, based mostly upon Bordeaux grapes. The forward cherry-berry flavors push through with some power into a chocolate-malted explosion with peppery highlights."
55878,wine_55878,South Africa,"Vanilla, honey, citrus and spice aromas lead this luscious white blend from Bellingham. On the palate, vanilla, lemon and creamy white fruit all mingle in a round, integrated character, but are spun with spice. A pretty, appealing white with something for everyone.",Fair Maiden,89,19.0,Franschhoek,,,Susan Kostrzewa,@suskostrzewa,Bellingham 2008 Fair Maiden White (Franschhoek),White Blend,Bellingham,"Wine for preference modeling. Title: Bellingham 2008 Fair Maiden White (Franschhoek). Variety: White Blend. Country: South Africa. Province: Franschhoek. Points: 89. Price: 19.0. Description: Vanilla, honey, citrus and spice aromas lead this luscious white blend from Bellingham. On the palate, vanilla, lemon and creamy white fruit all mingle in a round, integrated character, but are spun with spice. A pretty, appealing white with something for everyone."
30227,wine_30227,US,"Notes of honeyed nut and yellow apple fill the nose, with traces of tropical fruit and white flower adding interest. The palate is light to medium bodied, and it offers fresh acidity. While the wine doesn't exude Viognier's exotic, voluptuous traits, it demonstrates the grape's restrained, elegant side.",,86,22.0,Virginia,Shenandoah Valley,,,,Barren Ridge 2011 Viognier (Shenandoah Valley),Viognier,Barren Ridge,"Wine for preference modeling. Title: Barren Ridge 2011 Viognier (Shenandoah Valley). Variety: Viognier. Country: US. Province: Virginia. Points: 86. Price: 22.0. Description: Notes of honeyed nut and yellow apple fill the nose, with traces of tropical fruit and white flower adding interest. The palate is light to medium bodied, and it offers fresh acidity. While the wine doesn't exude Viognier's exotic, voluptuous traits, it demonstrates the grape's restrained, elegant side."
89336,wine_89336,US,"This might be called banana Port, for a rich, banana flavor is what dominates. Of course, with Muscat, you will also find tangerine and orange, like a tangy sauce over the richer, creamier banana. You've got to think—pair this with a banana split? Could be the dessert of the century!",Port,87,28.0,Oregon,Willamette Valley,Willamette Valley,Paul Gregutt,@paulgwine,David Hill 2006 Port Muscat (Willamette Valley),Muscat,David Hill,"Wine for preference modeling. Title: David Hill 2006 Port Muscat (Willamette Valley). Variety: Muscat. Country: US. Province: Oregon. Points: 87. Price: 28.0. Description: This might be called banana Port, for a rich, banana flavor is what dominates. Of course, with Muscat, you will also find tangerine and orange, like a tangy sauce over the richer, creamier banana. You've got to think—pair this with a banana split? Could be the dessert of the century!"
