row_id,wine_id,country,description,designation,points,price,province,region_1,region_2,taster_name,taster_twitter_handle,title,variety,winery,text
23135,wine_23135,France,"This wine is smooth, floral and lightly honeyed. With tangy acidity that balances its creamy texture, it's also full, rich and stylish. Produced from the Vermentino grape (Vermentinu in the local dialect), it's generous and ready to drink.",,89,22.0,France Other,Patrimonio,,Roger Voss,@vossroger,Clos Alivu 2016 Vermentino (Patrimonio),Vermentino,Clos Alivu,"Wine for preference modeling. Title: Clos Alivu 2016 Vermentino (Patrimonio). Variety: Vermentino. Country: France. Province: France Other. Points: 89. Price: 22.0. Description: This wine is smooth, floral and lightly honeyed. With tangy acidity that balances its creamy texture, it's also full, rich and stylish. Produced from the Vermentino grape (Vermentinu in the local dialect), it's generous and ready to drink."
87298,wine_87298,US,"Archery Summit's top cuvée is young and brash, a jangle of brambly berries, threads of incense and chocolate, assertive acids and not quite integrated tannins. It will require some patience, either in the cellar, or in the decanter (hours!) but has an underlying plush texture and an exotic mix of spices that elevate the pretty fruit to the next level.",Archery Summit Estate,93,150.0,Oregon,Dundee Hills,Willamette Valley,Paul Gregutt,@paulgwine,Archery Summit 2008 Archery Summit Estate Pinot Noir (Dundee Hills),Pinot Noir,Archery Summit,"Wine for preference modeling. Title: Archery Summit 2008 Archery Summit Estate Pinot Noir (Dundee Hills). Variety: Pinot Noir. Country: US. Province: Oregon. Points: 93. Price: 150.0. Description: Archery Summit's top cuvée is young and brash, a jangle of brambly berries, threads of incense and chocolate, assertive acids and not quite integrated tannins. It will require some patience, either in the cellar, or in the decanter (hours!) but has an underlying plush texture and an exotic mix of spices that elevate the pretty fruit to the next level."
3437,wine_3437,US,"Hibiscus and strawberry scents make an appealing invitation on the nose of this bottling, and then light cola and pepper spice up the ante. This would be a great red for warmer weather, served with a slight chill that would still allow the flavors of sandalwood, red cherry and marjoram to emerge.",,88,22.0,California,Central Coast,Central Coast,Matt Kettmann,@mattkettmann,MooBuzz 2015 G-S-M (Central Coast),G-S-M,MooBuzz,"Wine for preference modeling. Title: MooBuzz 2015 G-S-M (Central Coast). Variety: G-S-M. Country: US. Province: California. Points: 88. Price: 22.0. Description: Hibiscus and strawberry scents make an appealing invitation on the nose of this bottling, and then light cola and pepper spice up the ante. This would be a great red for warmer weather, served with a slight chill that would still allow the flavors of sandalwood, red cherry and marjoram to emerge."
30951,wine_30951,Argentina,"Opens with tire rubber, char and minty, smoky black fruit. Feels mostly fresh and bold, with blackberry, blueberry and coffee flavors. Just dense, sweet and spicy enough, with espresso bitterness to the finish. Composed and competent value red wine.",Trumpeter,87,11.0,Mendoza Province,Mendoza,,Michael Schachner,@wineschach,Rutini 2010 Trumpeter Malbec-Syrah (Mendoza),Malbec-Syrah,Rutini,"Wine for preference modeling. Title: Rutini 2010 Trumpeter Malbec-Syrah (Mendoza). Variety: Malbec-Syrah. Country: Argentina. Province: Mendoza Province. Points: 87. Price: 11.0. Description: Opens with tire rubber, char and minty, smoky black fruit. Feels mostly fresh and bold, with blackberry, blueberry and coffee flavors. Just dense, sweet and spicy enough, with espresso bitterness to the finish. Composed and competent value red wine."
15254,wine_15254,France,"With seven years on lees before disgorgement, this wine already shows some maturity. It is rich while also having the intense acidity of the vintage. Turning to gold in color, it is balanced and dry as with all the Paillard wines, although with age that character becomes less obvious. Drink now for the fruit or until 2024.",Assemblage Extra Brut,93,88.0,Champagne,Champagne,,Roger Voss,@vossroger,Bruno Paillard 2008 Assemblage Extra Brut  (Champagne),Champagne Blend,Bruno Paillard,"Wine for preference modeling. Title: Bruno Paillard 2008 Assemblage Extra Brut (Champagne). Variety: Champagne Blend. Country: France. Province: Champagne. Points: 93. Price: 88.0. Description: With seven years on lees before disgorgement, this wine already shows some maturity. It is rich while also having the intense acidity of the vintage. Turning to gold in color, it is balanced and dry as with all the Paillard wines, although with age that character becomes less obvious. Drink now for the fruit or until 2024."
22750,wine_22750,Italy,"Paola Gloder's estate can do better than this, especially in a vintage like 1997. The wine is already showing signs of aging and it has a lightweight character. The fruit is pleasant enough, with soft tannins and ripeness, but it should be more exciting. Tasted twice.",,84,60.0,Tuscany,Brunello di Montalcino,,Roger Voss,@vossroger,Poggio Antico 1997  Brunello di Montalcino,Sangiovese,Poggio Antico,"Wine for preference modeling. Title: Poggio Antico 1997 Brunello di Montalcino. Variety: Sangiovese. Country: Italy. Province: Tuscany. Points: 84. Price: 60.0. Description: Paola Gloder's estate can do better than this, especially in a vintage like 1997. The wine is already showing signs of aging and it has a lightweight character. The fruit is pleasant enough, with soft tannins and ripeness, but it should be more exciting. Tasted twice."
79706,wine_79706,US,"High-toned aromas of black cherry syrup and orange peel carry the nose. The thick, syrupy palate lacks much acidity and is reminiscent of flat Dr. Pepper, yet a roasted coffee tone is welcomed on the finish.",Light Madeira,82,40.0,Texas,Texas,,Alexander Peartree,,Haak 2009 Light Madeira Jacquez (Texas),Jacquez,Haak,"Wine for preference modeling. Title: Haak 2009 Light Madeira Jacquez (Texas). Variety: Jacquez. Country: US. Province: Texas. Points: 82. Price: 40.0. Description: High-toned aromas of black cherry syrup and orange peel carry the nose. The thick, syrupy palate lacks much acidity and is reminiscent of flat Dr. Pepper, yet a roasted coffee tone is welcomed on the finish."
112286,wine_112286,US,"There's a candied tone on this honeyed white blend (predominantly Grüner Veltliner)that extends from nose to palate. It's sunny pineapple and peach flavors are indeed tasty, but can seem a bit confected in style.",Tribute,85,26.0,New York,North Fork of Long Island,Long Island,Anna Lee C. Iijima,,One Woman 2011 Tribute White (North Fork of Long Island),White Blend,One Woman,"Wine for preference modeling. Title: One Woman 2011 Tribute White (North Fork of Long Island). Variety: White Blend. Country: US. Province: New York. Points: 85. Price: 26.0. Description: There's a candied tone on this honeyed white blend (predominantly Grüner Veltliner)that extends from nose to palate. It's sunny pineapple and peach flavors are indeed tasty, but can seem a bit confected in style."
92806,wine_92806,US,"Golden honey in color, the Ramspeck Sassolini is lush with lemon flavor and high acidity that lingers on the palate, crisp and tart. Sourced from Lake County fruit, a fine place for crisp whites, this wine is balanced in alcohol and richness too.",Sassolini,87,14.0,California,Lake County,,Virginie Boone,@vboone,Ramspeck 2010 Sassolini Pinot Grigio (Lake County),Pinot Grigio,Ramspeck,"Wine for preference modeling. Title: Ramspeck 2010 Sassolini Pinot Grigio (Lake County). Variety: Pinot Grigio. Country: US. Province: California. Points: 87. Price: 14.0. Description: Golden honey in color, the Ramspeck Sassolini is lush with lemon flavor and high acidity that lingers on the palate, crisp and tart. Sourced from Lake County fruit, a fine place for crisp whites, this wine is balanced in alcohol and richness too."
38496,wine_38496,Slovenia,"Aromas of honeysuckle, yellow canned peach and wet slate lead to flavors of grapefruit peel, citrus blossom and lemon zest in the mouth. The finish is crisp and zippy.",Rebula,89,22.0,Goriska Brda,,,Jeff Jenssen,@worldwineguys,Ferdinand 2014 Rebula Ribolla Gialla (Goriska Brda),Ribolla Gialla,Ferdinand,"Wine for preference modeling. Title: Ferdinand 2014 Rebula Ribolla Gialla (Goriska Brda). Variety: Ribolla Gialla. Country: Slovenia. Province: Goriska Brda. Points: 89. Price: 22.0. Description: Aromas of honeysuckle, yellow canned peach and wet slate lead to flavors of grapefruit peel, citrus blossom and lemon zest in the mouth. The finish is crisp and zippy."
22560,wine_22560,US,"Ripe aromas of burnt sugar, mango and pineapple introduce this bold, expansive Gewürztraminer. Drier on the palate than Keuka Spring's regular label Gewürztraminer, it boasts fresh lychee, rose petal and grapefruit flavors tied together with a bristling thread of astringency.",Dynamite Vineyard,89,22.0,New York,Finger Lakes,Finger Lakes,Anna Lee C. Iijima,,Keuka Spring 2015 Dynamite Vineyard Gewürztraminer (Finger Lakes),Gewürztraminer,Keuka Spring,"Wine for preference modeling. Title: Keuka Spring 2015 Dynamite Vineyard Gewürztraminer (Finger Lakes). Variety: Gewürztraminer. Country: US. Province: New York. Points: 89. Price: 22.0. Description: Ripe aromas of burnt sugar, mango and pineapple introduce this bold, expansive Gewürztraminer. Drier on the palate than Keuka Spring's regular label Gewürztraminer, it boasts fresh lychee, rose petal and grapefruit flavors tied together with a bristling thread of astringency."
10590,wine_10590,US,"Blackberry and cherry notes are fresh and primary in this Merlot-based Bordeaux blend, but shaded with interesting notes of coffee and smoke. The palate is juicy and supple with soft, furry tannins that accentuate a velvety mouthfeel. It's a boldly structured wine, but elegantly framed and long on the finish.",Horse Rescue Mirage,87,25.0,New York,North Fork of Long Island,Long Island,Anna Lee C. Iijima,,Baiting Hollow Farm Vineyard 2010 Horse Rescue Mirage Red (North Fork of Long Island),Bordeaux-style Red Blend,Baiting Hollow Farm Vineyard,"Wine for preference modeling. Title: Baiting Hollow Farm Vineyard 2010 Horse Rescue Mirage Red (North Fork of Long Island). Variety: Bordeaux-style Red Blend. Country: US. Province: New York. Points: 87. Price: 25.0. Description: Blackberry and cherry notes are fresh and primary in this Merlot-based Bordeaux blend, but shaded with interesting notes of coffee and smoke. The palate is juicy and supple with soft, furry tannins that accentuate a velvety mouthfeel. It's a boldly structured wine, but elegantly framed and long on the finish."
84294,wine_84294,US,"A blend of 83% Merlot and 17% Cabernet Sauvignon, this robust red is juicy and smoky, offering tastes of blackberry, cassis and mocha. Dusty tannins give a heaviness, accented by black licorice on the finish.",Mat Kearney,88,22.0,California,Napa Valley,Napa,Virginie Boone,@vboone,Verse & Chorus 2013 Mat Kearney Red (Napa Valley),Red Blend,Verse & Chorus,"Wine for preference modeling. Title: Verse & Chorus 2013 Mat Kearney Red (Napa Valley). Variety: Red Blend. Country: US. Province: California. Points: 88. Price: 22.0. Description: A blend of 83% Merlot and 17% Cabernet Sauvignon, this robust red is juicy and smoky, offering tastes of blackberry, cassis and mocha. Dusty tannins give a heaviness, accented by black licorice on the finish."
19530,wine_19530,Ukraine,"On the nose, this nonvintage sparkler from the Ukraine has primary notes of yeast and freshly baked bread There are soft flavors of green apple and peach in the mouth with gentle persistent bubbles.",Brut,83,10.0,Ukraine,,,Jeff Jenssen,@worldwineguys,Marengo NV Brut Sparkling (Ukraine),Sparkling Blend,Marengo,"Wine for preference modeling. Title: Marengo NV Brut Sparkling (Ukraine). Variety: Sparkling Blend. Country: Ukraine. Province: Ukraine. Points: 83. Price: 10.0. Description: On the nose, this nonvintage sparkler from the Ukraine has primary notes of yeast and freshly baked bread There are soft flavors of green apple and peach in the mouth with gentle persistent bubbles."
45706,wine_45706,Italy,"Named after Etna's most infamous eruption that lasted for 10 years, this elegant wine offers aromas of rose, violet and red berry. The silky, subtle palate delivers wild cherry, raspberry and white pepper flavors alongside supple tannins. Drink through 2018.",Eruzione 1614,92,34.0,Sicily & Sardinia,Sicilia,,Kerin O’Keefe,@kerinokeefe,Planeta 2012 Eruzione 1614 Nerello Mascalese (Sicilia),Nerello Mascalese,Planeta,"Wine for preference modeling. Title: Planeta 2012 Eruzione 1614 Nerello Mascalese (Sicilia). Variety: Nerello Mascalese. Country: Italy. Province: Sicily & Sardinia. Points: 92. Price: 34.0. Description: Named after Etna's most infamous eruption that lasted for 10 years, this elegant wine offers aromas of rose, violet and red berry. The silky, subtle palate delivers wild cherry, raspberry and white pepper flavors alongside supple tannins. Drink through 2018."
28345,wine_28345,US,"Made in a big, bold, full-bodied style, this blend is showy in juicy blackberry, cedar and currant, flavors that are surrounded by firm, integrated tannin. A taste of cigar and chocolate gives the end note a nightcap kind of feel.",The Equalizer,89,20.0,California,Sonoma County,Sonoma,Virginie Boone,@vboone,Ammunition 2014 The Equalizer Red (Sonoma County),Red Blend,Ammunition,"Wine for preference modeling. Title: Ammunition 2014 The Equalizer Red (Sonoma County). Variety: Red Blend. Country: US. Province: California. Points: 89. Price: 20.0. Description: Made in a big, bold, full-bodied style, this blend is showy in juicy blackberry, cedar and currant, flavors that are surrounded by firm, integrated tannin. A taste of cigar and chocolate gives the end note a nightcap kind of feel."
76761,wine_76761,US,"This is a co-ferment (with native yeast) of 45% Viognier, 30% Marsanne and 25% Roussanne. Exceptional details and mouth-pleasing textures lend extra pleasure throughout this Rhône white blend. Green melon, cucumber and tart tropical fruits carry the succulent and refreshing palate on through a deep dive into an immaculate finish.",Spiral 36,92,28.0,Oregon,Applegate Valley,Southern Oregon,Paul Gregutt,@paulgwine,Cowhorn 2016 Spiral 36 White (Applegate Valley),Rhône-style White Blend,Cowhorn,"Wine for preference modeling. Title: Cowhorn 2016 Spiral 36 White (Applegate Valley). Variety: Rhône-style White Blend. Country: US. Province: Oregon. Points: 92. Price: 28.0. Description: This is a co-ferment (with native yeast) of 45% Viognier, 30% Marsanne and 25% Roussanne. Exceptional details and mouth-pleasing textures lend extra pleasure throughout this Rhône white blend. Green melon, cucumber and tart tropical fruits carry the succulent and refreshing palate on through a deep dive into an immaculate finish."
32944,wine_32944,Australia,"Delivers rather standard Chardonnay aromas and flavors, ranging from hints of toast to ripe peaches and pineapple. It's nicely balanced, showing some lush texture on the midpalate yet retaining citrusy freshness on the finish. Well done, and well priced. Drink now.",Chook Raffle,87,14.0,South Australia,Adelaide Hills,,Joe Czerwinski,@JoeCz,Shoofly 2007 Chook Raffle Chardonnay (Adelaide Hills),Chardonnay,Shoofly,"Wine for preference modeling. Title: Shoofly 2007 Chook Raffle Chardonnay (Adelaide Hills). Variety: Chardonnay. Country: Australia. Province: South Australia. Points: 87. Price: 14.0. Description: Delivers rather standard Chardonnay aromas and flavors, ranging from hints of toast to ripe peaches and pineapple. It's nicely balanced, showing some lush texture on the midpalate yet retaining citrusy freshness on the finish. Well done, and well priced. Drink now."
107437,wine_107437,Czech Republic,"On the nose, spice outweighs fruit, with notes of clove and cinnamon backed by a touch of cherry. On the palate, the tables are turned, with black plum and cherry flavors playing host to a soft touch of baking spice that is most evident on the soft finish.",Znovín Znojmo,88,15.0,Moravia,,,Jeff Jenssen,@worldwineguys,Vino z Czech 2013 Znovín Znojmo St. Laurent (Moravia),St. Laurent,Vino z Czech,"Wine for preference modeling. Title: Vino z Czech 2013 Znovín Znojmo St. Laurent (Moravia). Variety: St. Laurent. Country: Czech Republic. Province: Moravia. Points: 88. Price: 15.0. Description: On the nose, spice outweighs fruit, with notes of clove and cinnamon backed by a touch of cherry. On the palate, the tables are turned, with black plum and cherry flavors playing host to a soft touch of baking spice that is most evident on the soft finish."
62508,wine_62508,US,"Hartford's blended Zin is filled with exuberant aromas of jammy “Zinberry” fruit, baking spices like cinnamon and clove, bittersweet chocolate and black pepper. The vibrant mixed-berry flavors are rich and satisfying, finishing with a touch of warmth and softness.",,91,34.0,California,Russian River Valley,Sonoma,,,Hartford 1999 Zinfandel (Russian River Valley),Zinfandel,Hartford,"Wine for preference modeling. Title: Hartford 1999 Zinfandel (Russian River Valley). Variety: Zinfandel. Country: US. Province: California. Points: 91. Price: 34.0. Description: Hartford's blended Zin is filled with exuberant aromas of jammy “Zinberry” fruit, baking spices like cinnamon and clove, bittersweet chocolate and black pepper. The vibrant mixed-berry flavors are rich and satisfying, finishing with a touch of warmth and softness."
122645,wine_122645,US,"A proprietary, nonvintage blend sourced from Lodi that's 70% Cabernet Sauvignon, 20% Old Vine Zinfandel and 10% Syrah, a wine with bright black and red fruit, good concentration and thick, oaky tannins.",Diamante Super Donne,85,13.0,California,California,California Other,Virginie Boone,@vboone,Sharabella Wines NV Diamante Super Donne Red (California),Red Blend,Sharabella Wines,"Wine for preference modeling. Title: Sharabella Wines NV Diamante Super Donne Red (California). Variety: Red Blend. Country: US. Province: California. Points: 85. Price: 13.0. Description: A proprietary, nonvintage blend sourced from Lodi that's 70% Cabernet Sauvignon, 20% Old Vine Zinfandel and 10% Syrah, a wine with bright black and red fruit, good concentration and thick, oaky tannins."
65799,wine_65799,Austria,"A rounded, creamy, spicy wine that brings out the Rotgipfler's full-bodied character. The wine has an edgy acidity that cuts its richness. Impressive wine, with a feeling of concentration.",Tagelsteiner,90,,Thermenregion,,,Roger Voss,@vossroger,Stadlmann 2009 Tagelsteiner Rotgipfler (Thermenregion),Rotgipfler,Stadlmann,"Wine for preference modeling. Title: Stadlmann 2009 Tagelsteiner Rotgipfler (Thermenregion). Variety: Rotgipfler. Country: Austria. Province: Thermenregion. Points: 90. Price: . Description: A rounded, creamy, spicy wine that brings out the Rotgipfler's full-bodied character. The wine has an edgy acidity that cuts its richness. Impressive wine, with a feeling of concentration."
16969,wine_16969,US,"Young, sharp, and spicy, with underlying layers of peach, apricot, Meyer lemon, butter and caramel. This clearly needs a lot more cellar time to reach its full potential, but it is already a lovely wine to sip at meal's end.",Fancy Pants Late Harvest,90,30.0,Washington,Red Mountain,Columbia Valley,Paul Gregutt,@paulgwine,Mark Ryan 2008 Fancy Pants Late Harvest Sémillon (Red Mountain),Sémillon,Mark Ryan,"Wine for preference modeling. Title: Mark Ryan 2008 Fancy Pants Late Harvest Sémillon (Red Mountain). Variety: Sémillon. Country: US. Province: Washington. Points: 90. Price: 30.0. Description: Young, sharp, and spicy, with underlying layers of peach, apricot, Meyer lemon, butter and caramel. This clearly needs a lot more cellar time to reach its full potential, but it is already a lovely wine to sip at meal's end."
114833,wine_114833,US,"Tight and unyielding, with a dominating Band-Aid streak that does not disappear even after many hours of breathing time. There is some Walla Walla Syrah berry and loam character evident, and the vineyards are first rate (Seven Hills and Pepper Bridge), but the reductive, plastic flavor masks much of the fruit.",,87,32.0,Oregon,Walla Walla Valley (OR),Oregon Other,Paul Gregutt,@paulgwine,Nuthatch Cellars 2007 Syrah (Walla Walla Valley (OR)),Syrah,Nuthatch Cellars,"Wine for preference modeling. Title: Nuthatch Cellars 2007 Syrah (Walla Walla Valley (OR)). Variety: Syrah. Country: US. Province: Oregon. Points: 87. Price: 32.0. Description: Tight and unyielding, with a dominating Band-Aid streak that does not disappear even after many hours of breathing time. There is some Walla Walla Syrah berry and loam character evident, and the vineyards are first rate (Seven Hills and Pepper Bridge), but the reductive, plastic flavor masks much of the fruit."
112289,wine_112289,US,"This has a reductive nose, with stewed blackberry giving a fruity side to the barnyard-y aromas. The flavors are earthy and savory, with some cigar box surrounding it all, but not tons of fruit.",The Octopus,85,22.0,California,Paso Robles,Central Coast,Matt Kettmann,@mattkettmann,Deep Sea 2011 The Octopus Merlot (Paso Robles),Merlot,Deep Sea,"Wine for preference modeling. Title: Deep Sea 2011 The Octopus Merlot (Paso Robles). Variety: Merlot. Country: US. Province: California. Points: 85. Price: 22.0. Description: This has a reductive nose, with stewed blackberry giving a fruity side to the barnyard-y aromas. The flavors are earthy and savory, with some cigar box surrounding it all, but not tons of fruit."
18600,wine_18600,US,"Rustic and a little sweet tasting, this has flavors of cherry pie, red currant and toast. Drink it with cheeseburgers.",,84,10.0,California,California,California Other,,,Insomnia 2010 Red (California),Red Blend,Insomnia,"Wine for preference modeling. Title: Insomnia 2010 Red (California). Variety: Red Blend. Country: US. Province: California. Points: 84. Price: 10.0. Description: Rustic and a little sweet tasting, this has flavors of cherry pie, red currant and toast. Drink it with cheeseburgers."
20029,wine_20029,Portugal,"Named after the impressive 10-mile long Vasco da Gama bridge that spans the Tagus estuary, this wine is soft, rounded and fruity. It has delicious, ready-to-drink flavors of ripe cherries and juicy plums. The fruit is sustained by the dry tannins and fresh acidity. Drink now.",10 Mile Bridge,86,,Península de Setúbal,,,Roger Voss,@vossroger,Cooperativa Agricola de Santo Isidro de Pegoes 2014 10 Mile Bridge Castelão (Península de Setúbal),Castelão,Cooperativa Agricola de Santo Isidro de Pegoes,"Wine for preference modeling. Title: Cooperativa Agricola de Santo Isidro de Pegoes 2014 10 Mile Bridge Castelão (Península de Setúbal). Variety: Castelão. Country: Portugal. Province: Península de Setúbal. Points: 86. Price: . Description: Named after the impressive 10-mile long Vasco da Gama bridge that spans the Tagus estuary, this wine is soft, rounded and fruity. It has delicious, ready-to-drink flavors of ripe cherries and juicy plums. The fruit is sustained by the dry tannins and fresh acidity. Drink now."
38837,wine_38837,US,"This may be the best bottling yet by actress Drew Barrymore and her team. The pale-pink wine offers light pink lemonade, plum, cherry and bubblegum aromas. The palate combines lime juice, pluot flesh and mandarin zest, set against a chalky backbone and laced with bright acidity.",Rosé of,90,18.0,California,Monterey County,Central Coast,Matt Kettmann,@mattkettmann,Barrymore by Carmel Road 2016 Rosé of Pinot Noir (Monterey County),Pinot Noir,Barrymore by Carmel Road,"Wine for preference modeling. Title: Barrymore by Carmel Road 2016 Rosé of Pinot Noir (Monterey County). Variety: Pinot Noir. Country: US. Province: California. Points: 90. Price: 18.0. Description: This may be the best bottling yet by actress Drew Barrymore and her team. The pale-pink wine offers light pink lemonade, plum, cherry and bubblegum aromas. The palate combines lime juice, pluot flesh and mandarin zest, set against a chalky backbone and laced with bright acidity."
129413,wine_129413,Australia,"A bit more austere than some of Kilikanoon's other cuveés, Mort's Block is in it for the long haul. Still a baby, it currently shows lemon-lime characters, with kerosene and Barbie doll plastic. The palate is linear and supercitrusy. Drink 2018–2025.",Mort's Block,89,20.0,South Australia,Clare Valley,,,,Kilikanoon 2016 Mort's Block Riesling (Clare Valley),Riesling,Kilikanoon,"Wine for preference modeling. Title: Kilikanoon 2016 Mort's Block Riesling (Clare Valley). Variety: Riesling. Country: Australia. Province: South Australia. Points: 89. Price: 20.0. Description: A bit more austere than some of Kilikanoon's other cuveés, Mort's Block is in it for the long haul. Still a baby, it currently shows lemon-lime characters, with kerosene and Barbie doll plastic. The palate is linear and supercitrusy. Drink 2018–2025."
