row_id,wine_id,country,description,designation,points,price,province,region_1,region_2,taster_name,taster_twitter_handle,title,variety,winery,text
121958,wine_121958,US,"Made without oak fermentation or barrel aging, this wine is the essence of Santa Ynez fruit. It's savory and rich with lemons, limes, kiwis and oranges, as well as a touch of tart gooseberry.",Mesa Verde Vineyard,90,22.0,California,Santa Ynez Valley,Central Coast,,,Brander 2012 Mesa Verde Vineyard Sauvignon Blanc (Santa Ynez Valley),Sauvignon Blanc,Brander,"Wine for preference modeling. Title: Brander 2012 Mesa Verde Vineyard Sauvignon Blanc (Santa Ynez Valley). Variety: Sauvignon Blanc. Country: US. Province: California. Points: 90. Price: 22.0. Description: Made without oak fermentation or barrel aging, this wine is the essence of Santa Ynez fruit. It's savory and rich with lemons, limes, kiwis and oranges, as well as a touch of tart gooseberry."
39994,wine_39994,Italy,"A blend of Tintore and Per'e Palummo (a grape native to the Island of Ischia), there is a thorny, raw quality to this wine that is backed by Asian spice, incense, spice, tobacco and mature black fruit. The wine has a thin, almost metallic taste, with spicy fruit tones on the close.",Costa d'Amalfi Tramonti,84,18.0,Southern Italy,Campania,,,,Giuseppe Apicella 2006 Costa d'Amalfi Tramonti Red (Campania),Red Blend,Giuseppe Apicella,"Wine for preference modeling. Title: Giuseppe Apicella 2006 Costa d'Amalfi Tramonti Red (Campania). Variety: Red Blend. Country: Italy. Province: Southern Italy. Points: 84. Price: 18.0. Description: A blend of Tintore and Per'e Palummo (a grape native to the Island of Ischia), there is a thorny, raw quality to this wine that is backed by Asian spice, incense, spice, tobacco and mature black fruit. The wine has a thin, almost metallic taste, with spicy fruit tones on the close."
30987,wine_30987,US,"Great value for the price, with blackberry marmalade, moo shu plum sauce, tobacco, leather and pepper flavors that turn richly tannic and spicy in the finish. Shows lots of elegance and finesse.",Sixgill,87,10.0,California,California,California Other,,,Shark Trust 2005 Sixgill Syrah (California),Syrah,Shark Trust,"Wine for preference modeling. Title: Shark Trust 2005 Sixgill Syrah (California). Variety: Syrah. Country: US. Province: California. Points: 87. Price: 10.0. Description: Great value for the price, with blackberry marmalade, moo shu plum sauce, tobacco, leather and pepper flavors that turn richly tannic and spicy in the finish. Shows lots of elegance and finesse."
100999,wine_100999,Portugal,"Writer Hans Christian Andersen lived in Portugal for a short time and this is a homage from the Danish owner of Cortes de Cima. It's a powerful wine with a dark side that's very suitable for those fairy stories. Big tannins, black fruits and a dense structure all promise aging. Drink from 2018.",Homenagem a Hans Christian Andersen,92,45.0,Alentejano,,,Roger Voss,@vossroger,Cortes de Cima 2011 Homenagem a Hans Christian Andersen Red (Alentejano),Portuguese Red,Cortes de Cima,"Wine for preference modeling. Title: Cortes de Cima 2011 Homenagem a Hans Christian Andersen Red (Alentejano). Variety: Portuguese Red. Country: Portugal. Province: Alentejano. Points: 92. Price: 45.0. Description: Writer Hans Christian Andersen lived in Portugal for a short time and this is a homage from the Danish owner of Cortes de Cima. It's a powerful wine with a dark side that's very suitable for those fairy stories. Big tannins, black fruits and a dense structure all promise aging. Drink from 2018."
1121,wine_1121,France,"This wine came out of the disaster of shriveled Duras grapes after an especially hot period. Rather than discarding them, Domaine Rotier made a wine. Wood aged, it has many of the characters of a late harvest with its rich, sweet, lightly tannic flavors and sufficient acidity to balance. A surprising success.",Noces de Feu,90,,France Other,Vin de Liqueur,,Roger Voss,@vossroger,Domaine Rotier NV Noces de Feu Duras (Vin de Liqueur),Duras,Domaine Rotier,"Wine for preference modeling. Title: Domaine Rotier NV Noces de Feu Duras (Vin de Liqueur). Variety: Duras. Country: France. Province: France Other. Points: 90. Price: . Description: This wine came out of the disaster of shriveled Duras grapes after an especially hot period. Rather than discarding them, Domaine Rotier made a wine. Wood aged, it has many of the characters of a late harvest with its rich, sweet, lightly tannic flavors and sufficient acidity to balance. A surprising success."
62384,wine_62384,Austria,"A rounded style of wine, its texture full of warm fruits, pear, apricot and some lime juice to give a fresh edge. It is full of flavor, with apples and cream flavors, layered with crisp, tight acidity, but all within the context of a full, dense wine. Glass stopper.",Undhof Kögl,89,29.0,Kremstal,,,Roger Voss,@vossroger,Salomon-Undhof 2007 Undhof Kögl Riesling (Kremstal),Riesling,Salomon-Undhof,"Wine for preference modeling. Title: Salomon-Undhof 2007 Undhof Kögl Riesling (Kremstal). Variety: Riesling. Country: Austria. Province: Kremstal. Points: 89. Price: 29.0. Description: A rounded style of wine, its texture full of warm fruits, pear, apricot and some lime juice to give a fresh edge. It is full of flavor, with apples and cream flavors, layered with crisp, tight acidity, but all within the context of a full, dense wine. Glass stopper."
5071,wine_5071,US,"Plush and mouthfilling, this blend of Petit Sirah, Malbec, Cabernet Franc, Syrah and Tinta Cão comes with notes of wild berries, cedar, flowers and spiced cocoa. Dusty, tongue-coating tannins keep the palate grounded.",The Hundreth Monkey,87,50.0,Colorado,Grand Valley,,,,The Infinite Monkey Theorem 2012 The Hundreth Monkey Red (Grand Valley),Red Blend,The Infinite Monkey Theorem,"Wine for preference modeling. Title: The Infinite Monkey Theorem 2012 The Hundreth Monkey Red (Grand Valley). Variety: Red Blend. Country: US. Province: Colorado. Points: 87. Price: 50.0. Description: Plush and mouthfilling, this blend of Petit Sirah, Malbec, Cabernet Franc, Syrah and Tinta Cão comes with notes of wild berries, cedar, flowers and spiced cocoa. Dusty, tongue-coating tannins keep the palate grounded."
27537,wine_27537,Spain,"Abelis Carthago's top wine, Fighting Bulls, is also its toughest to enjoy. There's overripeness and barnyard on the nose, and thus the prune, black plum and jammy berry flavors that control the palate are not surprising. Big and forceful for sure, but also choppy and incongruent across the palate.",Fighting Bulls,88,60.0,Northern Spain,Toro,,Michael Schachner,@wineschach,Abelis Carthago 2004 Fighting Bulls  (Toro),Tinta de Toro,Abelis Carthago,"Wine for preference modeling. Title: Abelis Carthago 2004 Fighting Bulls (Toro). Variety: Tinta de Toro. Country: Spain. Province: Northern Spain. Points: 88. Price: 60.0. Description: Abelis Carthago's top wine, Fighting Bulls, is also its toughest to enjoy. There's overripeness and barnyard on the nose, and thus the prune, black plum and jammy berry flavors that control the palate are not surprising. Big and forceful for sure, but also choppy and incongruent across the palate."
106425,wine_106425,Australia,"Straightforward Australian Shiraz, combining mulberry fruit with vanilla oak. It lacks richness and expansiveness on the palate. A solid effort, but a bit of a disappointment given the history of the label and the suggested pricing.",Classic Clare,86,45.0,South Australia,Clare Valley,,Joe Czerwinski,@JoeCz,Leasingham 2005 Classic Clare Shiraz (Clare Valley),Shiraz,Leasingham,"Wine for preference modeling. Title: Leasingham 2005 Classic Clare Shiraz (Clare Valley). Variety: Shiraz. Country: Australia. Province: South Australia. Points: 86. Price: 45.0. Description: Straightforward Australian Shiraz, combining mulberry fruit with vanilla oak. It lacks richness and expansiveness on the palate. A solid effort, but a bit of a disappointment given the history of the label and the suggested pricing."
110969,wine_110969,Georgia,"Honey gold in color, this wine made from an indigenous Georgian grape has a bouquet of white cherries and lavender. Tart flavors of honeydew melon and white plum persist into the soft floral finish.",Dry Unfiltered,84,28.0,Georgia,,,Mike DeSimone,@worldwineguys,Gotsa Family Wines 2015 Dry Unfiltered Chinuri (Georgia),Chinuri,Gotsa Family Wines,"Wine for preference modeling. Title: Gotsa Family Wines 2015 Dry Unfiltered Chinuri (Georgia). Variety: Chinuri. Country: Georgia. Province: Georgia. Points: 84. Price: 28.0. Description: Honey gold in color, this wine made from an indigenous Georgian grape has a bouquet of white cherries and lavender. Tart flavors of honeydew melon and white plum persist into the soft floral finish."
73213,wine_73213,US,"Black plum and cherry aromas pick up an undergrowth hint. This is a succulent, juicy wine with a finish that tastes earthy and feels structured.",Furnace Mountain Dry,86,32.0,Virginia,Virginia,,,,8 Chains North 2010 Furnace Mountain Dry Red (Virginia),Red Blend,8 Chains North,"Wine for preference modeling. Title: 8 Chains North 2010 Furnace Mountain Dry Red (Virginia). Variety: Red Blend. Country: US. Province: Virginia. Points: 86. Price: 32.0. Description: Black plum and cherry aromas pick up an undergrowth hint. This is a succulent, juicy wine with a finish that tastes earthy and feels structured."
25285,wine_25285,Turkey,"This bright, brambly red blend of two Turkish grapes, the Öküzgözü and the Bogazkere, is brisk and bold on the palate with a striking red cherry acidity. It's delicate in fruit profile, but lushly textured with layers of fine, chalky tannins that penetrate deeply on the finish.",Buzbag Rezerv Öküzgözü Bogazkere,86,25.0,Elazığ-Diyarbakir,,,Anna Lee C. Iijima,,Kayra 2007 Buzbag Rezerv Öküzgözü Bogazkere Red (Elazığ-Diyarbakir),Red Blend,Kayra,"Wine for preference modeling. Title: Kayra 2007 Buzbag Rezerv Öküzgözü Bogazkere Red (Elazığ-Diyarbakir). Variety: Red Blend. Country: Turkey. Province: Elazığ-Diyarbakir. Points: 86. Price: 25.0. Description: This bright, brambly red blend of two Turkish grapes, the Öküzgözü and the Bogazkere, is brisk and bold on the palate with a striking red cherry acidity. It's delicate in fruit profile, but lushly textured with layers of fine, chalky tannins that penetrate deeply on the finish."
99400,wine_99400,US,"The first of the Girl Next Door wines is well done. It features a sexy, pin-up style label and good Chardonnay juice, barrel-fermented and generous. Peach and citrus fruits, with supporting acids and moderate oak flavors of buttery caramel.",The Girl Next Door ‘Roll in the Hay',88,14.0,Washington,Columbia Valley (WA),Columbia Valley,Paul Gregutt,@paulgwine,Alexandria Nicole 2006 The Girl Next Door ‘Roll in the Hay' Chardonnay (Columbia Valley (WA)),Chardonnay,Alexandria Nicole,"Wine for preference modeling. Title: Alexandria Nicole 2006 The Girl Next Door ‘Roll in the Hay' Chardonnay (Columbia Valley (WA)). Variety: Chardonnay. Country: US. Province: Washington. Points: 88. Price: 14.0. Description: The first of the Girl Next Door wines is well done. It features a sexy, pin-up style label and good Chardonnay juice, barrel-fermented and generous. Peach and citrus fruits, with supporting acids and moderate oak flavors of buttery caramel."
41914,wine_41914,England,"Aromatic overtones of meadow flowers with just a touch of cotton candy hover over the lemony freshness. The palate balances mellow richness with taut acidity and creates a friendly tension between those poles. There is abundant apple fruit, both tart and sweet and a clean, dry finish that accentuates autolysis.",Balfour 1503 Classic Cuvée,89,,England,,,Anne Krebiehl MW,@AnneInVino,Hush Heath Estate NV Balfour 1503 Classic Cuvée Sparkling (England),Sparkling Blend,Hush Heath Estate,"Wine for preference modeling. Title: Hush Heath Estate NV Balfour 1503 Classic Cuvée Sparkling (England). Variety: Sparkling Blend. Country: England. Province: England. Points: 89. Price: . Description: Aromatic overtones of meadow flowers with just a touch of cotton candy hover over the lemony freshness. The palate balances mellow richness with taut acidity and creates a friendly tension between those poles. There is abundant apple fruit, both tart and sweet and a clean, dry finish that accentuates autolysis."
58429,wine_58429,Italy,"Feldmarschall is a delicately fragrant white wine with soapy aromas of white flower, honeysuckle and passion fruit. There's a touch of natural rubber as well and the mouthfeel is dense and rich in glycerin.",Feldmarschall von Fenner,87,35.0,Northeastern Italy,Alto Adige,,,,Tiefenbrunner 2010 Feldmarschall von Fenner Müller-Thurgau (Alto Adige),Müller-Thurgau,Tiefenbrunner,"Wine for preference modeling. Title: Tiefenbrunner 2010 Feldmarschall von Fenner Müller-Thurgau (Alto Adige). Variety: Müller-Thurgau. Country: Italy. Province: Northeastern Italy. Points: 87. Price: 35.0. Description: Feldmarschall is a delicately fragrant white wine with soapy aromas of white flower, honeysuckle and passion fruit. There's a touch of natural rubber as well and the mouthfeel is dense and rich in glycerin."
56115,wine_56115,Spain,This Godello feels composed and solid. Dry white-fruit aromas are reticent and oily. Flavors of peach and golden apple finish with stability and a sense of class. Drink now.,,89,20.0,Northern Spain,Bierzo,,Michael Schachner,@wineschach,Pazo Pondal 2015 Godello (Bierzo),Godello,Pazo Pondal,Wine for preference modeling. Title: Pazo Pondal 2015 Godello (Bierzo). Variety: Godello. Country: Spain. Province: Northern Spain. Points: 89. Price: 20.0. Description: This Godello feels composed and solid. Dry white-fruit aromas are reticent and oily. Flavors of peach and golden apple finish with stability and a sense of class. Drink now.
88501,wine_88501,Israel,"Aromas of black cherry, saddle leather and coffee prepare the palate for flavors of raspberry, cherry, mocha, and mountainside herbs. There is a pleasing balance of grippy tannins and bright acidity, with an especially zesty flash of cherry on the finish.",Canaan,88,12.0,Galilee,,,Mike DeSimone,@worldwineguys,Dalton 2014 Canaan Red (Galilee),Red Blend,Dalton,"Wine for preference modeling. Title: Dalton 2014 Canaan Red (Galilee). Variety: Red Blend. Country: Israel. Province: Galilee. Points: 88. Price: 12.0. Description: Aromas of black cherry, saddle leather and coffee prepare the palate for flavors of raspberry, cherry, mocha, and mountainside herbs. There is a pleasing balance of grippy tannins and bright acidity, with an especially zesty flash of cherry on the finish."
123027,wine_123027,US,"This is an unusual blend of 72% Syrah with the rest equal parts Mourvèdre and Cabernet Sauvignon. It largely works, with aromas of black pepper, cocoa, coffee, herbs and brown spices. The cranberry and meat flavors offer a sense of balance and restraint along with a pleasing mouthfeel and flavors that linger.",Sophia,90,29.0,Washington,Columbia Valley (WA),Columbia Valley,Sean P. Sullivan,@wawinereport,Mosquito Fleet 2011 Sophia Red (Columbia Valley (WA)),Red Blend,Mosquito Fleet,"Wine for preference modeling. Title: Mosquito Fleet 2011 Sophia Red (Columbia Valley (WA)). Variety: Red Blend. Country: US. Province: Washington. Points: 90. Price: 29.0. Description: This is an unusual blend of 72% Syrah with the rest equal parts Mourvèdre and Cabernet Sauvignon. It largely works, with aromas of black pepper, cocoa, coffee, herbs and brown spices. The cranberry and meat flavors offer a sense of balance and restraint along with a pleasing mouthfeel and flavors that linger."
39220,wine_39220,Italy,"Forest floor, new leather, tobacco and crushed herb aromas emerge in the glass. It's youthfully austere and a bit lean, with sour cherry, pomegranate, sage and white pepper framed in vibrant acidity and assertive fine-grained tannins. Drink 2023–2035.",Bussia,89,,Piedmont,Barolo,,Kerin O’Keefe,@kerinokeefe,Arnaldo Rivera 2013 Bussia  (Barolo),Nebbiolo,Arnaldo Rivera,"Wine for preference modeling. Title: Arnaldo Rivera 2013 Bussia (Barolo). Variety: Nebbiolo. Country: Italy. Province: Piedmont. Points: 89. Price: . Description: Forest floor, new leather, tobacco and crushed herb aromas emerge in the glass. It's youthfully austere and a bit lean, with sour cherry, pomegranate, sage and white pepper framed in vibrant acidity and assertive fine-grained tannins. Drink 2023–2035."
111852,wine_111852,Chile,"Good body and a fair amount of richness here. The nose is on the heavier, rubbery side, and it dulls down rather than expands. On the palate, Huique is warm, sweet, figgy and a little syrupy, with soft fruit and a touch of bitterness on the finish.",,86,13.0,Colchagua Valley,,,Michael Schachner,@wineschach,El Huique 2007 Carmenère (Colchagua Valley),Carmenère,El Huique,"Wine for preference modeling. Title: El Huique 2007 Carmenère (Colchagua Valley). Variety: Carmenère. Country: Chile. Province: Colchagua Valley. Points: 86. Price: 13.0. Description: Good body and a fair amount of richness here. The nose is on the heavier, rubbery side, and it dulls down rather than expands. On the palate, Huique is warm, sweet, figgy and a little syrupy, with soft fruit and a touch of bitterness on the finish."
34869,wine_34869,South Africa,"Winemaker: Gordon Newton Johnson. Herbal streaks of foliage and earthy spice frame the core raspberry, cherry and game tones of this pretty Pinot. It's lightweight and easy drinking, with soft tannins and ripe red-fruit flavors that are accented by notes of Dr. Pepper and forest floor. Though it's approachable and drinkable now, it should also cellar well through 2020.",Cape Winemakers Guild Seadragon,90,,Hemel en Aarde,,,Lauren Buzzeo,@laurbuzz,Newton Johnson 2015 Cape Winemakers Guild Seadragon Pinot Noir (Hemel en Aarde),Pinot Noir,Newton Johnson,"Wine for preference modeling. Title: Newton Johnson 2015 Cape Winemakers Guild Seadragon Pinot Noir (Hemel en Aarde). Variety: Pinot Noir. Country: South Africa. Province: Hemel en Aarde. Points: 90. Price: . Description: Winemaker: Gordon Newton Johnson. Herbal streaks of foliage and earthy spice frame the core raspberry, cherry and game tones of this pretty Pinot. It's lightweight and easy drinking, with soft tannins and ripe red-fruit flavors that are accented by notes of Dr. Pepper and forest floor. Though it's approachable and drinkable now, it should also cellar well through 2020."
113264,wine_113264,Portugal,"A fruity red, with jammy plum flavors and a smooth texture. The wine shows some of the elegance for which Taylor Fladgate is famed, while also offering a rich aftertaste.",Fine Ruby,87,,Port,,,Roger Voss,@vossroger,Taylor Fladgate NV Fine Ruby  (Port),Port,Taylor Fladgate,"Wine for preference modeling. Title: Taylor Fladgate NV Fine Ruby (Port). Variety: Port. Country: Portugal. Province: Port. Points: 87. Price: . Description: A fruity red, with jammy plum flavors and a smooth texture. The wine shows some of the elegance for which Taylor Fladgate is famed, while also offering a rich aftertaste."
55613,wine_55613,Croatia,"From the island of Hvar, this wine has aromas of Chinese tea and cranberry juice. There's also a pleasant feral note in the complex bouquet. It has flavors of cranberry juice and black cherry tart with grippy tannins and a persistent finish.",Plovac Polški,88,27.0,Hvar,,,Jeff Jenssen,@worldwineguys,Carić 2008 Plovac Polški Plavac Mali (Hvar),Plavac Mali,Carić,"Wine for preference modeling. Title: Carić 2008 Plovac Polški Plavac Mali (Hvar). Variety: Plavac Mali. Country: Croatia. Province: Hvar. Points: 88. Price: 27.0. Description: From the island of Hvar, this wine has aromas of Chinese tea and cranberry juice. There's also a pleasant feral note in the complex bouquet. It has flavors of cranberry juice and black cherry tart with grippy tannins and a persistent finish."
42052,wine_42052,Greece,"This rare Greek variety expresses itself here with aromas of lime and quince, and fresh green flavors of citrus and cucumber. Refreshing but also creamy. A unique wine that will pair well with grilled fish or octopus.",The Gift of Dionysos,85,23.0,Greece,,,Susan Kostrzewa,@suskostrzewa,A. Parparoussis 2009 The Gift of Dionysos Sideritis (Greece),Sideritis,A. Parparoussis,"Wine for preference modeling. Title: A. Parparoussis 2009 The Gift of Dionysos Sideritis (Greece). Variety: Sideritis. Country: Greece. Province: Greece. Points: 85. Price: 23.0. Description: This rare Greek variety expresses itself here with aromas of lime and quince, and fresh green flavors of citrus and cucumber. Refreshing but also creamy. A unique wine that will pair well with grilled fish or octopus."
70042,wine_70042,Romania,"This slightly sweet Moscato has aromas of fresh cut pineapple, magnolia, peaches, honeysuckle and dried anise seed. The palate gets lychee and apricot.",Dreambird,86,7.0,Viile Timisului,,,Jeff Jenssen,@worldwineguys,Cramele Recas 2014 Dreambird Moscato (Viile Timisului),Moscato,Cramele Recas,"Wine for preference modeling. Title: Cramele Recas 2014 Dreambird Moscato (Viile Timisului). Variety: Moscato. Country: Romania. Province: Viile Timisului. Points: 86. Price: 7.0. Description: This slightly sweet Moscato has aromas of fresh cut pineapple, magnolia, peaches, honeysuckle and dried anise seed. The palate gets lychee and apricot."
83535,wine_83535,France,"This is a straightforward but easy-to-enjoy selection, boasting upfront aromas and flavors of peach, watermelon rind and white currant. Light weight and bright in mouthwatering acidity, a hint of fresh-cut grass graces the clean finish.",Lily Pad Pink,85,14.0,Languedoc-Roussillon,Pays d'Oc,,Lauren Buzzeo,@laurbuzz,Arrogant Frog 2015 Lily Pad Pink Rosé (Pays d'Oc),Rosé,Arrogant Frog,"Wine for preference modeling. Title: Arrogant Frog 2015 Lily Pad Pink Rosé (Pays d'Oc). Variety: Rosé. Country: France. Province: Languedoc-Roussillon. Points: 85. Price: 14.0. Description: This is a straightforward but easy-to-enjoy selection, boasting upfront aromas and flavors of peach, watermelon rind and white currant. Light weight and bright in mouthwatering acidity, a hint of fresh-cut grass graces the clean finish."
38112,wine_38112,Austria,Composer Joseph Haydn was the court composer for the Esterházy family which still owns this winery. This strongly wood-aged wine has its own elegance and style with fruit coming through strongly from under the darker exterior. Give this finely structured wine time and drink from 2017.,Haydn,90,,Burgenland,,,Roger Voss,@vossroger,Esterházy 2009 Haydn Merlot (Burgenland),Merlot,Esterházy,Wine for preference modeling. Title: Esterházy 2009 Haydn Merlot (Burgenland). Variety: Merlot. Country: Austria. Province: Burgenland. Points: 90. Price: . Description: Composer Joseph Haydn was the court composer for the Esterházy family which still owns this winery. This strongly wood-aged wine has its own elegance and style with fruit coming through strongly from under the darker exterior. Give this finely structured wine time and drink from 2017.
72603,wine_72603,Spain,"Add Aurora to your list of dry Sherries that won't steer you wrong. It is a concentrated, slightly more powerful style of manzanilla with pear, pepper and rosemary aromas as well as a true, refined palate. Flavors of fresh mushroom and nuts are dry and just fruity enough. Like a kiss from the sea.",Aurora Manzanilla Extra Dry,89,13.0,Andalucia,Jerez,,Michael Schachner,@wineschach,Pedro Romero NV Aurora Manzanilla Extra Dry Sherry (Jerez),Sherry,Pedro Romero,"Wine for preference modeling. Title: Pedro Romero NV Aurora Manzanilla Extra Dry Sherry (Jerez). Variety: Sherry. Country: Spain. Province: Andalucia. Points: 89. Price: 13.0. Description: Add Aurora to your list of dry Sherries that won't steer you wrong. It is a concentrated, slightly more powerful style of manzanilla with pear, pepper and rosemary aromas as well as a true, refined palate. Flavors of fresh mushroom and nuts are dry and just fruity enough. Like a kiss from the sea."
100376,wine_100376,France,A firm and tannic wine from the most northerly of the Beaujolais cru villages near Bourgogne. Blackberry fruit and juicy acidity are a balance to this initially severe wine. Its dry core and mineral texture show that this wine will need to age. Drink from 2018.,,92,29.0,Beaujolais,Saint-Amour,,Roger Voss,@vossroger,Trenel Fils 2015  Saint-Amour,Gamay,Trenel Fils,Wine for preference modeling. Title: Trenel Fils 2015 Saint-Amour. Variety: Gamay. Country: France. Province: Beaujolais. Points: 92. Price: 29.0. Description: A firm and tannic wine from the most northerly of the Beaujolais cru villages near Bourgogne. Blackberry fruit and juicy acidity are a balance to this initially severe wine. Its dry core and mineral texture show that this wine will need to age. Drink from 2018.
18349,wine_18349,US,"Made with undisclosed grape varieties, this rustic, softly sweet wine has apricot, honey and herb flavors.",Angel Food,82,14.0,California,California,California Other,,,Cupcake 2010 Angel Food White (California),White Blend,Cupcake,"Wine for preference modeling. Title: Cupcake 2010 Angel Food White (California). Variety: White Blend. Country: US. Province: California. Points: 82. Price: 14.0. Description: Made with undisclosed grape varieties, this rustic, softly sweet wine has apricot, honey and herb flavors."
